{
  "$schema": "./orchestration-registry.schema.json",
  "schema_version": "8.0.0",
  "roles": [
    {
      "id": "orchestrator",
      "agent_id": "information-accessibility-reviewer",
      "producer_kind": "ai_agent",
      "input_types": ["screening-observations", "human-review-queue", "declared-human-review", "remediation-plan", "fix-authorization", "change-record"],
      "output_type": "audit-run",
      "max_ai_evidence_level": "E1",
      "can_record_profile_outcome": false,
      "can_write_target": false,
      "install_by_default": true
    },
    {
      "id": "e1_inspector",
      "agent_id": "information-accessibility-e1-inspector",
      "producer_kind": "ai_agent",
      "input_types": [],
      "output_type": "screening-observations",
      "max_ai_evidence_level": "E1",
      "can_record_profile_outcome": false,
      "can_write_target": false,
      "install_by_default": true
    },
    {
      "id": "human_queue_planner",
      "agent_id": "information-accessibility-human-queue-planner",
      "producer_kind": "ai_agent",
      "input_types": ["screening-observations"],
      "output_type": "human-review-queue",
      "max_ai_evidence_level": "E1",
      "can_record_profile_outcome": false,
      "can_write_target": false,
      "install_by_default": true
    },
    {
      "id": "declared_external_human",
      "agent_id": null,
      "producer_kind": "external_human",
      "input_types": ["human-review-queue"],
      "output_type": "declared-human-review",
      "max_ai_evidence_level": null,
      "can_record_profile_outcome": true,
      "can_write_target": false,
      "install_by_default": false
    },
    {
      "id": "remediation_planner",
      "agent_id": "information-accessibility-remediation-planner",
      "producer_kind": "ai_agent",
      "input_types": ["screening-observations", "declared-human-review"],
      "output_type": "remediation-plan",
      "max_ai_evidence_level": "E1",
      "can_record_profile_outcome": false,
      "can_write_target": false,
      "install_by_default": true
    },
    {
      "id": "declared_authorizer",
      "agent_id": null,
      "producer_kind": "external_requester",
      "input_types": ["remediation-plan"],
      "output_type": "fix-authorization",
      "max_ai_evidence_level": null,
      "can_record_profile_outcome": false,
      "can_write_target": false,
      "install_by_default": false
    },
    {
      "id": "authorized_fixer",
      "agent_id": "information-accessibility-authorized-fixer",
      "producer_kind": "ai_agent",
      "input_types": ["remediation-plan", "fix-authorization"],
      "output_type": "change-record",
      "max_ai_evidence_level": "E1",
      "can_record_profile_outcome": false,
      "can_write_target": true,
      "install_by_default": false
    }
  ],
  "artifact_types": [
    {
      "id": "audit-run",
      "latest_schema_version": "9.0.0",
      "schema_versions": [
        { "version": "1.0.0", "schema_file": "audit-run-1.0.0.schema.json", "mode": "read_only" },
        { "version": "2.0.0", "schema_file": "audit-run-2.0.0.schema.json", "mode": "read_only" },
        { "version": "3.0.0", "schema_file": "audit-run-3.0.0.schema.json", "mode": "read_only" },
        { "version": "4.0.0", "schema_file": "audit-run-4.0.0.schema.json", "mode": "read_only" },
        { "version": "5.0.0", "schema_file": "audit-run-5.0.0.schema.json", "mode": "read_only" },
        { "version": "6.0.0", "schema_file": "audit-run-6.0.0.schema.json", "mode": "read_only" },
        { "version": "7.0.0", "schema_file": "audit-run-7.0.0.schema.json", "mode": "read_only" },
        { "version": "8.0.0", "schema_file": "audit-run-8.0.0.schema.json", "mode": "read_only" },
        { "version": "9.0.0", "schema_file": "audit-run.schema.json", "schema_sha256": "94dcd37a190aaa7ef570312bb02adc9ccb50f52a98b4389269d69c6edf202a5b", "mode": "current" }
      ]
    },
    {
      "id": "screening-observations",
      "latest_schema_version": "3.0.0",
      "schema_versions": [
        { "version": "1.0.0", "schema_file": "screening-observations-1.0.0.schema.json", "mode": "read_only" },
        { "version": "2.0.0", "schema_file": "screening-observations-2.0.0.schema.json", "mode": "read_only" },
        { "version": "3.0.0", "schema_file": "screening-observations.schema.json", "schema_sha256": "268da46d8988039e5ff272166fa2ab13c3492a6a164ecadbb3ac07f47691e33b", "mode": "current" }
      ]
    },
    {
      "id": "human-review-queue",
      "latest_schema_version": "2.0.0",
      "schema_versions": [
        { "version": "1.0.0", "schema_file": "human-review-queue-1.0.0.schema.json", "mode": "read_only" },
        { "version": "2.0.0", "schema_file": "human-review-queue.schema.json", "schema_sha256": "a067686abafc4f8a2661c9b19410d4f27b409f697f6c89b289960ba51b129533", "mode": "current" }
      ]
    },
    {
      "id": "declared-human-review",
      "latest_schema_version": "1.0.0",
      "schema_versions": [
        { "version": "1.0.0", "schema_file": "declared-human-review.schema.json", "schema_sha256": "f4732affdb197ae02d56bf1cdccda2978422b127a1b8c5f173ed452ba1198f7a", "mode": "current" }
      ]
    },
    {
      "id": "remediation-plan",
      "latest_schema_version": "2.0.0",
      "schema_versions": [
        { "version": "1.0.0", "schema_file": "remediation-plan-1.0.0.schema.json", "mode": "read_only" },
        { "version": "2.0.0", "schema_file": "remediation-plan.schema.json", "schema_sha256": "b8036ca3587b1a91a89baa034ac4807f5f228ed6bbb1d6e898e96c5ce6b79f92", "mode": "current" }
      ]
    },
    {
      "id": "fix-authorization",
      "latest_schema_version": "2.0.0",
      "schema_versions": [
        { "version": "1.0.0", "schema_file": "fix-authorization-1.0.0.schema.json", "mode": "read_only" },
        { "version": "2.0.0", "schema_file": "fix-authorization.schema.json", "schema_sha256": "13579db07d5c0f86f70fd41bb490ad61167051372072ad633ed0c9c1775a5e62", "mode": "current" }
      ]
    },
    {
      "id": "change-record",
      "latest_schema_version": "2.0.0",
      "schema_versions": [
        { "version": "1.0.0", "schema_file": "change-record-1.0.0.schema.json", "mode": "read_only" },
        { "version": "2.0.0", "schema_file": "change-record.schema.json", "schema_sha256": "0e7318a19b0a7e8b69ab2c30ab613866666cd4892f04721c419cb128a10fcb84", "mode": "current" }
      ]
    }
  ],
  "transitions": [
    { "from": "initialized", "to": "screened", "required_artifact_types": ["screening-observations"] },
    { "from": "screened", "to": "human_queue_ready", "required_artifact_types": ["human-review-queue"] },
    { "from": "human_queue_ready", "to": "human_review_recorded", "required_artifact_types": ["declared-human-review"] },
    { "from": "human_queue_ready", "to": "remediation_ready", "required_artifact_types": ["remediation-plan"] },
    { "from": "human_review_recorded", "to": "remediation_ready", "required_artifact_types": ["remediation-plan"] },
    { "from": "remediation_ready", "to": "fix_authorized", "required_artifact_types": ["fix-authorization"] },
    { "from": "fix_authorized", "to": "retest_required", "required_artifact_types": ["change-record"] }
  ]
}
